{
  "$schema": "https://json-schema.org/draft/2020-12/schema",
  "$id": "https://appcask.dev/schema/v1.json",
  "title": "AppcaskConfig",
  "description": "Configuration for an appcask app. One file describes the whole shell.",
  "type": "object",
  "additionalProperties": false,
  "required": ["identity", "startUrl"],
  "properties": {
    "$schema": { "type": "string" },
    "identity": {
      "type": "object",
      "additionalProperties": false,
      "required": ["appName", "packageName", "version"],
      "properties": {
        "appName": {
          "type": "string",
          "minLength": 1,
          "maxLength": 50,
          "description": "Human-readable name shown under the launcher icon."
        },
        "packageName": {
          "type": "string",
          "pattern": "^[a-z][a-z0-9_]*(\\.[a-z0-9_]+)+$",
          "description": "Reverse-DNS application id, e.g. com.acme.app. Also used as the iOS bundle id."
        },
        "version": {
          "type": "string",
          "pattern": "^\\d+\\.\\d+\\.\\d+$",
          "description": "Marketing version (x.y.z). The build number is derived unless overridden by the CLI."
        }
      }
    },
    "startUrl": {
      "type": "string",
      "format": "uri",
      "pattern": "^https://",
      "description": "The first URL the WebView loads. Must be https."
    },
    "internalHosts": {
      "type": "array",
      "description": "Hosts that stay inside the WebView. Anything else opens in an external browser tab. Defaults to the host of startUrl.",
      "items": { "type": "string", "pattern": "^[a-z0-9.-]+$" },
      "uniqueItems": true
    },
    "theme": {
      "type": "object",
      "additionalProperties": false,
      "properties": {
        "statusBar": {
          "type": "object",
          "additionalProperties": false,
          "properties": {
            "style": { "enum": ["light", "dark"], "default": "dark", "description": "Colour of the status-bar text/icons." },
            "color": { "$ref": "#/$defs/color", "description": "Status-bar background (Android)." }
          }
        },
        "navigationBarColor": { "$ref": "#/$defs/color", "description": "Android system navigation-bar colour." },
        "splash": {
          "type": "object",
          "additionalProperties": false,
          "required": ["background"],
          "properties": {
            "background": { "$ref": "#/$defs/color" },
            "logo": { "type": "string", "description": "Path (relative to the config file) to a centred splash logo, PNG with transparency." }
          }
        },
        "safeArea": {
          "enum": ["inset", "css-vars", "none"],
          "default": "inset",
          "description": "How the shell handles notches / status bar / home indicator. 'inset' (default): the WebView is padded to the safe area, filled with statusBar.color — any site looks right with no changes. 'css-vars': the WebView goes edge-to-edge and --appcask-{top,right,bottom,left}-inset are injected for the site to use. 'none': edge-to-edge, no help."
        },
        "insetSelectors": {
          "type": "array",
          "description": "Only with safeArea 'css-vars'. For an edge-to-edge look without editing the site: each entry offsets a fixed/sticky element by the safe-area inset. 'header' -> `header { top: var(--appcask-top-inset) }`; suffix '@bottom' pins to the bottom inset ('.fab@bottom').",
          "items": { "type": "string", "minLength": 1 },
          "uniqueItems": true
        }
      }
    },
    "navigation": {
      "type": "object",
      "additionalProperties": false,
      "properties": {
        "mode": {
          "enum": ["single", "tabs", "drawer"],
          "default": "single",
          "description": "single = one WebView. tabs = a native bottom bar. drawer = a slide-out menu (a button overlays the top-left)."
        },
        "tabs": {
          "type": "array",
          "description": "The navigation items — used when mode is 'tabs' or 'drawer'.",
          "items": {
            "type": "object",
            "additionalProperties": false,
            "required": ["label", "url"],
            "properties": {
              "label": { "type": "string", "minLength": 1, "maxLength": 16 },
              "url": { "type": "string", "format": "uri", "pattern": "^https://" },
              "icon": { "type": "string", "description": "Named icon or path to a 24dp glyph." }
            }
          }
        }
      }
    },
    "features": {
      "type": "object",
      "additionalProperties": false,
      "properties": {
        "userAgent": {
          "description": "The WebView User-Agent. 'chrome' (default): a clean mobile-Chrome string with no WebView marker, so embedded Google / Apple sign-in isn't blocked with disallowed_useragent. 'native': the platform default (contains '; wv'). Or pass your own string. `appcask/<version>` is appended unless you pass a full string.",
          "oneOf": [
            { "enum": ["chrome", "native"] },
            { "type": "string", "minLength": 10 }
          ],
          "default": "chrome"
        },
        "pullToRefresh": { "type": "boolean", "default": false },
        "offlinePage": { "type": "boolean", "default": true, "description": "Show a built-in offline screen when a load fails with no connection." },
        "fileAccess": { "type": "boolean", "default": true, "description": "Wire up <input type=file>, camera capture, and the native file picker." },
        "downloads": { "type": "boolean", "default": true, "description": "Route download responses through the OS download manager." },
        "shareTarget": {
          "type": "object",
          "additionalProperties": false,
          "required": ["url"],
          "description": "Register the app as a share target: when the user shares text / a link to it, the app opens `url` with the shared content URL-encoded and appended.",
          "properties": {
            "url": { "type": "string", "format": "uri", "pattern": "^https://", "description": "e.g. https://acme.example/new?body= — the shared text is appended, encoded." }
          }
        },
        "appReviewPrompt": { "type": "boolean", "default": false, "description": "Expose window.appcask.review.request() so the site can ask the OS to show its in-app review prompt." },
        "biometricLock": { "type": "boolean", "default": false, "description": "Require fingerprint / Face ID to open the app (and after it's been backgrounded). Also exposes window.appcask.biometric.authenticate()." },
        "externalBrowserAuth": {
          "type": "array",
          "description": "Domains whose pages must open in Custom Tabs / ASWebAuthenticationSession instead of the WebView (Google, Apple, Microsoft, ...). The redirect back to an internalHost is intercepted and the session handed to the WebView.",
          "items": { "type": "string", "pattern": "^[a-z0-9.-]+$" },
          "uniqueItems": true
        },
        "separateDocumentPatterns": {
          "type": "array",
          "description": "Path globs that are their own document, not a route inside your SPA. These load via native loadUrl to avoid the location.* navigation bounce. Example: /admin/*, /checkout",
          "items": { "type": "string" },
          "uniqueItems": true
        },
        "deepLinks": {
          "type": "object",
          "additionalProperties": false,
          "required": ["host"],
          "properties": {
            "host": { "type": "string", "pattern": "^[a-z0-9.-]+$" },
            "pathPatterns": {
              "type": "array",
              "items": { "type": "string" },
              "default": ["/*"],
              "description": "Verified App Link / Universal Link paths that open the app."
            }
          }
        },
        "push": {
          "type": "object",
          "additionalProperties": false,
          "required": ["provider"],
          "description": "Push notifications (roadmap).",
          "properties": {
            "provider": { "enum": ["fcm"], "description": "fcm covers Android now; APNs is added with the iOS shell." },
            "onTapUrlParam": {
              "type": "string",
              "default": "url",
              "description": "Data key on the push payload holding the URL to open on tap."
            }
          }
        },
        "updates": {
          "type": "object",
          "additionalProperties": false,
          "description": "Safe handling of the live site: a health check after each load, a remote kill-switch, and fall-back to the last version that worked.",
          "properties": {
            "manifestUrl": {
              "type": "string",
              "format": "uri",
              "pattern": "^https://",
              "description": "A JSON file you host (e.g. https://site.com/.well-known/appcask.json). Fetched on launch; can override startUrl, force a maintenance screen (\"blocked\": true), require a minimum shell version, or show a banner."
            },
            "healthCheck": {
              "type": "object",
              "additionalProperties": false,
              "properties": {
                "selector": {
                  "type": "string",
                  "description": "A CSS selector that must appear for the page to count as healthy. Default: the page just has to finish loading without an HTTP error."
                },
                "timeoutMs": { "type": "integer", "minimum": 1000, "maximum": 60000, "default": 12000 },
                "maxFailures": {
                  "type": "integer",
                  "minimum": 1,
                  "maximum": 10,
                  "default": 2,
                  "description": "Consecutive failed loads before onUnhealthy fires."
                }
              }
            },
            "onUnhealthy": {
              "enum": ["offline-screen", "retry", "previous"],
              "default": "previous",
              "description": "'previous': reload the last URL that passed the health check. 'offline-screen': show the built-in screen. 'retry': just reload."
            }
          }
        }
      }
    },
    "bridge": {
      "type": "object",
      "additionalProperties": false,
      "properties": {
        "allowedOrigins": {
          "type": "array",
          "description": "Origins allowed to call window.appcask at all. Defaults to https://<each internalHost>.",
          "items": { "type": "string", "format": "uri" },
          "uniqueItems": true
        },
        "grants": {
          "type": "array",
          "description": "Per-scope capability grants. OMIT this and every window.appcask method is allowed on every allowed origin. ADD it and the bridge is default-deny: a method call is refused unless a matching grant lists that capability (PERMISSION_DENIED).",
          "items": {
            "type": "object",
            "additionalProperties": false,
            "required": ["capabilities"],
            "properties": {
              "match": {
                "type": "object",
                "additionalProperties": false,
                "description": "Which pages this grant applies to. Omit to apply to every allowed origin.",
                "properties": {
                  "host": {
                    "type": "string",
                    "pattern": "^\\.?[a-z0-9.-]+$",
                    "description": "Exact host, or a leading-dot host (.acme.com) to also match sub-domains."
                  },
                  "pathPrefix": { "type": "string", "description": "URL path must start with this." },
                  "pathGlob": { "type": "string", "description": "URL path must match this glob (* = one segment, ** = any)." }
                }
              },
              "capabilities": {
                "type": "array",
                "minItems": 1,
                "uniqueItems": true,
                "description": "Method names, a namespace wildcard (secureStore.*, clipboard.*), or * for all.",
                "items": {
                  "type": "string",
                  "pattern": "^(\\*|[a-zA-Z]+(\\.[a-zA-Z]+|\\.\\*)?)$"
                }
              }
            }
          }
        }
      }
    }
  },
  "$defs": {
    "color": {
      "type": "string",
      "pattern": "^#(?:[0-9a-fA-F]{3}|[0-9a-fA-F]{6}|[0-9a-fA-F]{8})$",
      "description": "Hex colour: #rgb, #rrggbb, or #rrggbbaa."
    }
  }
}
